OCLC #,Title,Author,Language,Item type,Publication,Publisher,Year,Database,Notes,Added date
4435348672,Statistics of the hubble diagram. II. The form of the luminosity function and density variations with application to quasars,E L Turner; Harvard-Smithsonian Center for Astrophysics,English,artchap_artcl,Astrophys. J. v231:3 (1979 Aug 01): 645-652,,1979.0,,,2012-08-24 07:16
4437156346,Radiative and other effects from internal waves in solar and stellar interiors,W H Press; Harvard-Smithsonian Center for Astrophysics; Harvard University and Department of Physics,English,artchap_artcl,Astrophys. J. v245:1 (1981 Apr 01): 286-303,,1981.0,,,2012-08-24 07:16
4433435135,Nonlinear effects on cosmological perturbations. II. The production of isothermal perturbations by a primordial sound spectrum,E T Vishniac; Harvard-Smithsonian Center for Astrophysics; Princeton University and Department of Astrophysical Sciences,English,artchap_artcl,Astrophys. J. v253:2 (1982 Feb 15): 457-469,,1982.0,,,2012-08-24 07:16
4433225382,Line profiles of T tauri stars: Clues to the nature of the mass flow,L Hartmann; Harvard-Smithsonian Center for Astrophysics,English,artchap_artcl,"Astrophys. J., Suppl. Ser. v48:1 (1982 Jan 01): 109-126",,1982.0,,,2012-08-24 07:16
4436447256,The thermal phase of a large solar flare,G L Withbroe; Harvard-Smithsonian Center for Astrophysics,English,artchap_artcl,Astrophys. J. v225:2 (1978 Oct 15): 641-649,,1978.0,,,2012-08-24 07:16
4433622031,Optical analysis of dust complexes in spiral galaxies,D M Elmegreen; Harvard-Smithsonian Center for Astrophysics,English,artchap_artcl,"Astrophys. J., Suppl. Ser. v43:1 (1980 May 01): 37-56",,1980.0,,,2012-08-24 07:16
4435271707,Energy distributions of Be stars in clusters,R E Schild; Harvard-Smithsonian Center for Astrophysics,English,artchap_artcl,"Astrophys. J., Suppl. Ser. v37:1 (1978 May 01): 77-100",,1978.0,,,2012-08-24 07:16
4433584578,Statistics of the Hubble diagram. I. Determination of q/sub 2/ and luminosity evolution with application to quasars,E L Turner; Harvard-Smithsonian Center for Astrophysics,English,artchap_artcl,Astrophys. J. v230:2 (1979 Jun 01): 291-303,,1979.0,,,2012-08-24 07:16
4434632408,Collisional interaction of a beam of charged particles with a hydrogen target of arbitrary ionization level,A G Emslie; Harvard-Smithsonian Center for Astrophysics,English,artchap_artcl,Astrophys. J. v224:1 (1978 Aug 15): 241-246,,1978.0,,,2012-08-24 07:16
4433435141,Nonlinear effects on cosmological perturbations. I. The evolution of adiabatic perturbations,E T Vishniac; Harvard-Smithsonian Center for Astrophysics; Princeton University and Department of Astrophysical Sciences,English,artchap_artcl,Astrophys. J. v253:2 (1982 Feb 15): 446-456,,1982.0,,,2012-08-24 07:16
4433069762,Evolution of the optical spectrum of HM sagittae: 1977--1982,J R Stauffer; Harvard-Smithsonian Center for Astrophysics,English,artchap_artcl,Astrophys. J. v280:2 (1984 May 15): 695-711,,1984.0,,,2012-08-24 07:16
4433410998,Relativistic thermal plasmas: Pair processes and equilibria,A P Lightman; Harvard-Smithsonian Center for Astrophysics,English,artchap_artcl,Astrophys. J. v253:2 (1982 Feb 15): 842-858,,1982.0,,,2012-08-24 07:16
4434305971,Spectrophotometric classification of low-redshift quasars and active galactic nuclei,J E Steiner; Harvard-Smithsonian Center for Astrophysics; Universidade de Sao Paulo and IAG,English,artchap_artcl,Astrophys. J. v250:2 (1981 Nov 15): 469-477,,1981.0,,,2012-08-24 07:16
4433122977,Variations in the strength of spectral features in spheroidal galactic systems. I. The method and CN band variation,A Wirth; Harvard-Smithsonian Center for Astrophysics,English,artchap_artcl,Astrophys. J. v288:1 (1985 Jan 01): 132-137,,1985.0,,,2012-08-24 07:16
4436297891,Double Compton emission in radiation dominated thermal plasmas,A P Lightman; Harvard-Smithsonian Center for Astrophysics,English,artchap_artcl,Astrophys. J. v244:2 (1981 Mar 01): 392-405,,1981.0,,,2012-08-24 07:16
4435588788,Determination of magnetic fields in dense cloud complexes by the observation of Zeeman splitting,B G Elmegreen; Harvard-Smithsonian Center for Astrophysics,English,artchap_artcl,"Astrophys. J., Lett. v225:2 (1978 Oct 15): l85-l88",,1978.0,,,2012-08-24 07:16
4434373344,Two more globular cluster X-ray sources,J E Grindlay; Harvard-Smithsonian Center for Astrophysics,English,artchap_artcl,"Astrophys. J., Lett. v224:3 (1978 Sep 15): l107-l111",,1978.0,,,2012-08-24 07:16
4433852033,Dense cores in dark clouds. III. Subsonic turbulence,P C Myers; Harvard-Smithsonian Center for Astrophysics,English,artchap_artcl,Astrophys. J. v270:1 (1983 Jul 01): 105-118,,1983.0,,,2012-08-24 07:16
4434265612,Estimate of star formation efficiency in molecular clouds,T N Rengarajan; Harvard-Smithsonian Center for Astrophysics,English,artchap_artcl,Astrophys. J. v287:2 (1984 Dec 15): 671-675,,1984.0,,,2012-08-24 07:16
4433266847,Masses of X-ray bursters and super-Eddington luminosities,R Hoshi; Harvard-Smithsonian Center for Astrophysics,English,artchap_artcl,Astrophys. J. v247:2 (1981 Jul 15): 628-631,,1981.0,,,2012-08-24 07:16
4434418883,Star-formation history of very young clusters,S W Stahler; Harvard-Smithsonian Center for Astrophysics,English,artchap_artcl,Astrophys. J. v293:1 (1985 Jun 01): 207-215,,1985.0,,,2012-08-24 07:16
4434488390,Ages and distances of eight globular clusters,B W Carney; Harvard-Smithsonian Center for Astrophysics,English,artchap_artcl,"Astrophys. J., Suppl. Ser. v42:3 (1980 Mar 01): 481-500",,1980.0,,,2012-08-24 07:16
4434773154,Effect of reverse currents on the dynamics of nonthermal electron beams in solar flares and on their emitted X-ray bremsstrahlung,A G Emslie; Harvard-Smithsonian Center for Astrophysics,English,artchap_artcl,Astrophys. J. v235:3 (1980 Feb 01): 1055-1065,,1065.0,,,2012-08-24 07:16
4434971342,Nonparametric statistics of the quasar hubble diagrams,E L Turner; Harvard-Smithsonian Center for Astrophysics,English,artchap_artcl,"Astrophys. J., Lett. v228:2 (1979 Mar 01): l51-l54",,1979.0,,,2012-08-24 07:16
48460856,"Exploring the earth in motion : daylight, sun, and shadow patterns",Marvin C Grossman; Irwin I Shapiro; R  Bruce Ward; Harvard-Smithsonian Center for Astrophysics.,English,book,,"Watertown, MA : Charlesbridge",2000.0,,,2012-08-24 07:15
3319889,Algorithms for the HP-45 and HP-35,John A Ball,English,book,,"Cambridge, Mass. : Center for Astrophysics, Harvard College Observatory & Smithsonian Astrophysical Observatory",1975.0,,,2012-08-24 07:15
160021568,Surprises in mind,Carolyn Alexander Maher; Annenberg/CPB.;,English,video_digital,,"S. Burlington, Vt. : Annenberg/CPB",2001.0,,,2012-08-24 07:15
48460925,"Exploring the moon and stars : cycles, phases, and patterns",Marvin C Grossman; Harvard-Smithsonian Center for Astrophysics.; et al,English,book,,"Watertown, MA : Charlesbridge",2002.0,,,2012-08-24 07:15
160015906,A Private universe,Annenberg/CPB.;,English,video_digital,,"South Burlington, Vt. : Annenberg/CPB",1987.0,,,2012-08-24 07:15
11002612,"Einstein (HEAO-2) observing catalog : Einstein observations, October 31, 1983",Frederick D Seward; Allison Macdonald; Harvard-Smithsonian Center for Astrophysics.,English,book,,[S.l.] : Harvard-Smithsonian Center for Astrophysics,1983.0,,,2012-08-24 07:15
52400156,"The next move : steps toward change in elementary math and science, individual program descriptions.","Rebecca B Corwin; Heather Hurley, teacher.; Flavia Steiner Viggiani; Harvard-Smithsonian Center for Astrophysics.; Annenberg/CPB.;",English,book_digital,,,,,,2012-08-24 07:15
49313941,"Exploring energy : waterwheels, windmills, and sunlight",Marvin C Grossman; Irwin I Shapiro; R  Bruce Ward; Dana Riley Black; Harvard-Smithsonian Center for Astrophysics.,English,book,,"Watertown, MA : Charlesbridge",2001.0,,,2012-08-24 07:15
82557591,"Laboratory Space Science Workshop : April 01-03, 1998 : program, papers & abstracts.",United States. Office of Space Science.; Harvard-Smithsonian Center for Astrophysics.;,English,book,,"[Cambridge, Mass.] : Harvard-Smithsonian Center for Astrophysics",1998.0,,,2012-08-24 07:15
48144551,Project spectroscopy : 46810-00,Paul R Antonucci; Philip Michael Sadler; Harvard-Smithsonian Center for Astrophysics.,English,book,,"[Tonawanda, NY] : Science Kit & Boreal Laboratories",2000.0,,,2012-08-24 07:15
18011814,CCD analysis program,Stephen Thomas Kent; Harvard-Smithsonian Center for Astrophysics.,English,book,,"Cambridge, Mass. : Harvard-Smithsonian Center for Astrophysics",1982.0,,,2012-08-24 07:15
52587026,The private universe project in science,Nancy Finkelstein; Harvard-Smithsonian Center for Astrophysics.; Annenberg/CPB Project.;,English,video_digital,,,,,,2012-08-24 07:15
62568016,Classroom practice,Anna Lewicke; Matthew H Schneps; Douglas K Plante; Alex Griswold; Pedro Noguera; Coalition of Essential Schools.; Harvard-Smithsonian Center for Astrophysics. Science Media Group.;,English,video_dvd,,"Oakland, Calif. : Coalition of Essential Schools",2005.0,,,2012-08-24 07:15
49309385,"Exploring light & color : filters, lenses, and cameras",Marvin C Grossman; Irwin I Shapiro; R  Bruce Ward; Harvard-Smithsonian Center for Astrophysics.,English,book,,"Watertown, MA : Charlesbridge",2000.0,,,2012-08-24 07:15
18079312,Einstein Observatory : revised users' manual,D  E Harris; Harvard-Smithsonian Center for Astrophysics.;,English,book,,"[Cambridge, Mass.] : Harvard-Smithsonian Center for Astrophysics",1985.0,,,2012-08-24 07:15
52526730,"Exploring navigation : location, direction, and latitude",Marvin C Grossman; Judith F Peritz; Harvard-Smithsonian Center for Astrophysics.; et al,English,book,,"Watertown, MA : Charlesbridge",2003.0,,,2012-08-24 07:15
49315349,"Exploring waves : ripple tanks, vibrations, and sound",Marvin C Grossman; Harvard-Smithsonian Center for Astrophysics.; et al,English,book,,"Watertown, MA : Charlesbridge",2001.0,,,2012-08-24 07:15
49316445,"Exploring motion and forces : speed, acceleration, and friction",Marvin C Grossman; Irwin I Shapiro; R  Bruce Ward; Dana Riley Black; Harvard-Smithsonian Center for Astrophysics.,English,book,,"Watertown, MA : Charlesbridge",2001.0,,,2012-08-24 07:15
41754582,"Exploring time : sundials, water clocks, and pendulums : science journal",Marvin C Grossman; Irwin I Shapiro; R  Bruce Ward; Harvard-Smithsonian Center for Astrophysics.;,English,book,,"Watertown, MA : Charlesbridge",2000.0,,,2012-08-24 07:15
657628001,"Particle nature of matter : solids, liquids and gases",Sallie L Baliunas; Clive A Grainger; Robin Moriarty; Matthew H Schneps; Annenberg Media.; Harvard-Smithsonian Center for Astrophysics. Science Media Group.; Marcom Projects.;,English,video_dvd,,"Eight Mile Plains, Qld. : Marcom Projects [distributor]",2004.0,,,2012-08-24 07:15
23447036,The Universe in your desk : a resource guide for the teacher of high school astronomy,Darrel B Hoff; Project STAR.;,English,book,,"Cambridge, MA : Harvard-Smithsonian Center for Astrophysics",1990.0,,,2012-08-24 07:15
57630802,ASCE,Nigel Atkins; Harvard-Smithsonian Center for Astrophysics.;,English,video_dvd,,"[Cambridge, MA : Harvard-Smithsonian Center for Astrophysics]",2003.0,,,2012-08-24 07:15
141201320,Project STAR spectrometer,William Luzader; Harvard-Smithsonian Center for Astrophysics.; Learning Technologies Incorporated.;,English,object,,"Cambridge, MA : Harvard-Smithsomian Center for Astrophysics ; Somerville, MA : Learning Technologies Inc. [distributor]",1991.0,,,2012-08-24 07:15
183426098,Science in focus. / Force and motion,Annenberg Media.; Harvard-Smithsonian Center for Astrophysics. Science Media Group.;,English,video_dvd,,"S. Burlington, VT : Annenberg media",2001.0,,,2012-08-24 07:15
7711211,Location of the Norma transient with the HEAO-1 scanning modulation collimator,Giuseppina Fabbiano; Harvard-Smithsonian Center for Astrophysics.; Massachusetts Institute of Technology. Center for Space Research.; et al,English,book,,"Cambridge, Mass. : Harvard/Smithsonian Center for Astrophysics",1977.0,,,2012-08-24 07:15
7713146,Measurements of X-ray source positions by the scanning modulation collimator on HEAO-1,Herbert Gursky; Harvard-Smithsonian Center for Astrophysics.; Massachusetts Institute of Technology. Center for Space Research.; et al,English,book,,"Cambridge, Mass. : Harvard/Smithsonian Center for Astrophysics",1977.0,,,2012-08-24 07:15
34403149,A private universe,Lindsay Crouse; Matthew H Schneps; Philip M Sadler; Private Universe Project.; Annenberg/CPB Math and Science Project.;,English,video_vhs,,"[Cambridge, MA : Private Universe Project, Harvard-Smithsonian Center for Astrophysics]",1989.0,,,2012-08-24 07:15
31697364,Project SPICA : a teacher resource to enhance astronomy education,Nadine Butcher Ball; Harold P Coyle; Irwin I Shapiro; Harvard-Smithsonian Center for Astrophysics.;,English,book,,"Dubuque, Iowa : Kendall/Hunt",1994.0,,,2012-08-24 07:15
49554406,The private universe project,Chantal L  A Fujiwara; Lisa Friedman; Nancy Finkelstein; Harvard-Smithsonian Center for Astrophysics. Science Media Group.; Annenberg/CPB Project.;,English,video_vhs,,"S. Burlington, VT : Annenberg/CPB Math and Science Project",2002.0,,,2012-08-24 07:15
50135711,The next move : steps toward change in elementary math and science,"Rebecca B Corwin; Heather Hurley, teacher.; Flavia Steiner Viggiani; Harvard-Smithsonian Center for Astrophysics. Science Media Group.; Annenberg/CPB Math and Science Project.;",English,video_vhs,,"South Burlington, VT : Annenberg/CPB Math and Science Project",1998.0,,,2012-08-24 07:15
43830536,The molecular universe,David Anthony Neufeld; Harvard-Smithsonian Center for Astrophysics.,English,video_vhs,,,,,,2012-08-24 07:15
24788667,Where the galaxies are,Boyd Estus; Margaret J Geller; Astronomical Society of the Pacific.;,English,video_vhs,,"[Washington, DC] : Smithsonian Institution",1991.0,,,2012-08-24 07:15
503473565,WIPL news.,Wolbach Image Processing Laboratory.,English,jrnl,,"[Cambridge, Mass. : Harvard-Smithsonian Center for Astrophysics]",,,,2012-08-24 07:15
42466611,Mathematics: what's the big idea? : an eight-part workshop series for K-8 teachers of mathematics.,Annenberg/CPB Project.;,English,video_vhs,,"Cambridge, Mass : Harvard Smithsonian Center for Astrophysics at Harvard Univ. and Mass. Corp. for Educational Telecommunications",1999.0,,,2012-08-24 07:15
32078720,Annie and the stars of many colors : a portrait of astronomer Annie Jump Cannon,Barbara L Welther; Smithsonian Astrophysical Observatory.; Harvard-Smithsonian Center for Astrophysics.;,English,video_vhs,,"Cambridge, MA : Harvard-Smithsonian Center for Astrophysics",1993.0,,,2012-08-24 07:15
39186261,Under construction,Matthew Schneps; Michael Filisky; Ara Sahiner; Annenberg/CPB Math and Science Project.; Harvard-Smithsonian Center for Astrophysics. Science Media Group.; Annenberg/CPB Math and Science Collection.;,English,video_vhs,,"South Burlington, VT : Annenberg/CPB Math and Science Collection",1997.0,,,2012-08-24 07:15
43426623,Astrobiology : what is it and what can be done about it?,Andrew H Knoll; Harvard-Smithsonian Center for Astrophysics.,English,video_vhs,,,,,,2012-08-24 07:15
42078872,Chondrules and their origins,Elbert A King; Lunar and Planetary Institute.; Harvard-Smithsonian Center for Astrophysics.; United States. National Aeronautics and Space Administration.;,English,book_digital,,Houston [Tex.] : Lunar and Planetary Institute,1983.0,,,2012-08-24 07:15
39186071,Lessons from thin air,Matthew Schneps; Annenberg/CPB Math and Science Project.; Harvard-Smithsonian Center for Astrophysics. Science Media Group.; Annenberg/CPB Math and Science Collection.;,English,video_vhs,,"South Burlington, VT : Annenberg/CPB Math and Science Collection",1997.0,,,2012-08-24 07:15
741251177,Minds of our own,Annenberg/CPB Math and Science Collection.; Harvard University.; Harvard-Smithsonian Center for Astrophysics.;,English,video,,"[Boston, MA] : President and Fellows of Harvard College",1997.0,,,2012-08-24 07:15
32326017,A Private universe : misconceptions that block learning,Schneps Mat.; Pyramid Film & Video.; Harvard-Smithsonian Center for Astrophysics.; Corporation for Public Broadcasting.;,English,video_vhs,,[S.l. : Corp. for Public Broadcasting],1994.0,,,2012-08-24 07:14
496286755,Earth's changing climate,Daniel P Schrag; Christopher B Field; Lonnie G Thompson; Annenberg/CPB.; Harvard-Smithsonian Center for Astrophysics.; Harvard Environmental Economics Program.;,English,video_digital,,"South Burlington, Vt. : Annenberg/CPB",2007.0,,,2012-08-24 07:14
496285972,"Risk, exposure, and health",John D Spengler; Howard Hu; Robin M Whyatt; Annenberg/CPB.; Harvard-Smithsonian Center for Astrophysics.; Harvard Environmental Economics Program.;,English,video_digital,,"South Burlington, Vt. : Annenberg/CPB",2007.0,,,2012-08-24 07:14
496286886,Human population dynamics,David E Bloom; Deborah Balk; Martha Farnsworth Riche; Annenberg/CPB.; Harvard-Smithsonian Center for Astrophysics.; Harvard Environmental Economics Program.;,English,video_digital,,"South Burlington, Vt. : Annenberg/CPB",2007.0,,,2012-08-24 07:14
496285967,Ecosystems,Paul Moorcroft; Robert L Crabtree; Stuart James Davies; Annenberg/CPB.; Harvard-Smithsonian Center for Astrophysics.; Harvard Environmental Economics Program.;,English,video_digital,,"South Burlington, Vt. : Annenberg/CPB",2007.0,,,2012-08-24 07:14
496286900,Water resources,Charles F Harvey; Wendy D Graham; Thomas Maddock; Annenberg/CPB.; Harvard-Smithsonian Center for Astrophysics.; Harvard Environmental Economics Program.;,English,video_digital,,"South Burlington, Vt. : Annenberg/CPB",2007.0,,,2012-08-24 07:14
496285962,Oceans,James J McCarthy; Mark A Cane; Sallie W Chisholm; Annenberg/CPB.; Harvard-Smithsonian Center for Astrophysics.; Harvard Environmental Economics Program.;,English,video_digital,,"South Burlington, Vt. : Annenberg/CPB",2007.0,,,2012-08-24 07:14
496286732,Atmospheric pollution,"Daniel J Jacob; Charles E Kolb, Jr.; Luisa T Molina; Annenberg/CPB.; Harvard-Smithsonian Center for Astrophysics.; Harvard Environmental Economics Program.;",English,video_digital,,"South Burlington, Vt. : Annenberg/CPB",2007.0,,,2012-08-24 07:14
496286654,Agriculture,N  Michele Holbrook; Peter E Kenmore; P  A Matson; Annenberg/CPB.; Harvard-Smithsonian Center for Astrophysics.; Harvard Environmental Economics Program.;,English,video_digital,,"South Burlington, Vt. : Annenberg/CPB",2007.0,,,2012-08-24 07:14
496285980,Energy challenges,John P Holdren; John H Shaw; Andy Aden; Neeraj Gupta; Annenberg/CPB.; Harvard-Smithsonian Center for Astrophysics.; Harvard Environmental Economics Program.;,English,video_digital,,"South Burlington, Vt. : Annenberg/CPB",2007.0,,,2012-08-24 07:14
496286538,"Many planets, one Earth",Daniel P Schrag; Paul F Hoffman; Andrew H Knoll; Annenberg/CPB.; Harvard-Smithsonian Center for Astrophysics.; Harvard Environmental Economics Program.;,English,video_digital,,"South Burlington, Vt. : Annenberg/CPB",2007.0,,,2012-08-24 07:14
31524274,Where should we start?,Matthew H Schneps; Ara Sahiner; Alex Griswold; Chantal L  A Fujiwara; Lisa Freidman; Jim Chin; Robert Tai; Philip Scott; Nancy Finkelstein; Harvard-Smithsonian Center for Astrophysics. Science Education Dept.; Massachusetts Corporation for Educational Telecommunications.; Mass LearnPike.; Annenberg/CPB Math and Science Project.; Private Universe Project.;,English,video_vhs,,"[Cambridge, Mass.] : President and Fellows of Harvard College",1995.0,,,2012-08-24 07:14
613503012,"Proceedings of the Thirteenth International Symposium on Space Terahertz Technology : Tuesday-Thursday, March 26-28, 2002, Maxwell-Dworkin Building, Harvard University, Cambridge, Massachusetts.",Edward Tong; Raymond Blundell; National Radio Astronomy Observatory (U.S.); Harvard-Smithsonian Center for Astrophysics.;,English,book,,Cambridge Mass. : [s.n,2002.0,,,2012-08-24 07:14
496286902,Biodiversity decline,Anne Johnson Pringle; Jeremy B  C Jackson; William F Laurance; Annenberg/CPB.; Harvard-Smithsonian Center for Astrophysics.; Harvard Environmental Economics Program.;,English,video_digital,,"South Burlington, Vt. : Annenberg/CPB",2007.0,,,2012-08-24 07:14
34683041,Private universe project : workshop series preview tape,Melodie Hicks Arterberry; Nancy Finkelstein; Harvard-Smithsonian Center for Astrophysics. Science Education Dept.; Massachusetts Corporation for Educational Telecommunications.; Mass LearnPike.; Annenberg/CPB Math and Science Project.; Private Universe Project.;,English,video_vhs,,"[Cambridge, Mass.] : President and Fellows of Harvard College",1995.0,,,2012-08-24 07:14
496285987,Looking forward : our global experiment,Daniel P Schrag; D Pauly; Edward O Wilson; Annenberg/CPB.; Harvard-Smithsonian Center for Astrophysics.; Harvard Environmental Economics Program.;,English,video_digital,,"South Burlington, Vt. : Annenberg/CPB",2007.0,,,2012-08-24 07:14
6072160,Possible implications of the uncertainty principle for the time scale of gravitational collapse,Robert C Gilman,English,book,,"Cambridge, Mass. : Center for Astrophysics, Harvard College Observatory and Smithsonian Institution Observatory, l",975.0,,,2012-08-24 07:14
31453246,Can we believe our own eyes?,Matthew H Schneps; Ara Sahiner; Alex Griswold; Chantal L  A Fujiwara; Lisa Freidman; Brenda O'Connor; Sheila Donelan; Philip Michael Sadler; Richard Konicek; Nancy Finkelstein; Harvard-Smithsonian Center for Astrophysics. Science Education Dept.; Massachusetts Corporation for Educational Telecommunications.; Mass LearnPike.; Annenberg/CPB Math and Science Project.; Private Universe Project.;,English,video_vhs,,"[Cambridge, Mass.] : President and Fellows of Harvard College",1995.0,,,2012-08-24 07:14
42818124,The evolution of gas and stars in the merger galaxy NGC 1316 (Fornax A),G Mackie; Giuseppina Fabbiano; Harvard-Smithsonian Center for Astrophysics.; United States. National Aeronautics and Space Administration.,English,book_mic,,"Cambridge, Mass. : Harvard-Smithsonian Center for Astrophysics ; [Washington, DC : National Aeronautics and Space Administration ; Springfield, Va. : National Technical Information Service, distributor",1998.0,,,2012-08-24 07:14
182560419,"Freeze, freeze, fry : climate past, present and future.",Daniel P Schrag; Matthew H Schneps; Harvard-Smithsonian Center for Astrophysics.;,English,video_dvd,,"Cambridge, Mass. : Harvard University]",2007.0,,,2012-08-24 07:14
62503916,Cosmic questions : our place in space and time,Alex Griswold; Brian Claflin; John Doan; Melinda Lopez; Tim Douglas; Stacy Fischer; Daniel Davis; Harvard-Smithsonian Center for Astrophysics.;,English,video_dvd,,Boston : Smithsonian Institution Astrophysical Observatory,2004.0,,,2012-08-24 07:14
31635002,Taking a risk,Matthew H Schneps; Ara Sahiner; Alex Griswold; Chantal L  A Fujiwara; Lisa Freidman; Terez Waldoch; Kathleen Fisher; Barbara La Corte; Nancy Finkelstein; Harvard-Smithsonian Center for Astrophysics. Science Education Dept.; Massachusetts Corporation for Educational Telecommunications.; Mass LearnPike.; Annenberg/CPB Math and Science Project.; Private Universe Project.;,English,video_vhs,,"[Cambridge, Mass.] : President and Fellows of Harvard College",1995.0,,,2012-08-24 07:14
34682375,A schoolhouse with no foundation,Alex Griswold; Chantal L  A Fujiwara; Lisa Freidman; Jose Rivera; Mary Ann Nelson; Jean Huff; Audrey Sturgis; Jay Chandler; Philip Scott; Nancy Finkelstein; Harvard-Smithsonian Center for Astrophysics. Science Education Dept.; Massachusetts Corporation for Educational Telecommunications.; Mass LearnPike.; Annenberg/CPB Math and Science Project.; Private Universe Project.;,English,video_vhs,,"[Cambridge, Mass.] : President and Fellows of Harvard College",1995.0,,,2012-08-24 07:14
31406833,Eliciting student ideas,Matthew H Schneps; Ara Sahiner; Alex Griswold; Chantal L  A Fujiwara; Lisa Freidman; Trish Stoddart; Sam Palmer; Nancy Finkelstein; Harvard-Smithsonian Center for Astrophysics. Science Education Dept.; Massachusetts Corporation for Educational Telecommunications.; Mass LearnPike.; Annenberg/CPB Math and Science Project.; Private Universe Project.;,English,video_vhs,,"[Cambridge, Mass.] : President and Fellows of Harvard College",1995.0,,,2012-08-24 07:14
62503406,MouseLab,Melodie Hicks; Matthew H Schneps; Alex Griswold; Steven Allardi; Harvard-Smithsonian Center for Astrophysics.;,English,video_vhs,,"Harvard-Smithsonian Center for Astrophysics] , [Cambridge, Mass",1995.0,,,2012-08-24 07:14
31452978,Hands-on/minds-on learning,Matthew H Schneps; Ara Sahiner; Alex Griswold; Chantal L  A Fujiwara; Lisa Freidman; Jose Rivera; Richard Konicek; James Carter; Nancy Finkelstein; Harvard-Smithsonian Center for Astrophysics. Science Education Dept.; Massachusetts Corporation for Educational Telecommunications.; Mass LearnPike.; Annenberg/CPB Math and Science Project.; Private Universe Project.;,English,video_vhs,,"[Cambridge, Mass.] : President and Fellows of Harvard College",1995.0,,,2012-08-24 07:14
49544395,Looking at learning ... again 2,Veda C Reilley; Harvard-Smithsonian Center for Astrophysics. Science Media Group.; Annenberg/CPB Project.;,English,video_vhs,,"S. Burlington, VT : Annenberg/CPB Math and Science Project",2000.0,,,2012-08-24 07:14
34682122,Why are some ideas so difficult?,Alex Griswold; Chantal L  A Fujiwara; Lisa Freidman; Kathleen M Fisher; Bob Holden; Joseph Donald Novak; Nancy Finkelstein; Harvard-Smithsonian Center for Astrophysics. Science Education Dept.; Massachusetts Corporation for Educational Telecommunications.; Mass LearnPike.; Annenberg/CPB Math and Science Project.; Private Universe Project.;,English,video_vhs,,"[Cambridge, Mass.] : President and Fellows of Harvard College",1995.0,,,2012-08-24 07:14
768428250,SMA newsletter,Smithsonian Astrophysical Observatory.; Zhong yang yan jiu yuan. Institute of Astronomy and Astrophysics.;,English,jrnl_digital,,"Cambridge, Mass. : Harvard-Smithsonian Center for Astrophysics",,,,2012-08-24 07:14
